{
  "schema_version": 2,
  "kind": "timem.provider_model_catalog",
  "revision": 2,
  "activation": "runtime_supported",
  "coverage": "specified_model_pages_only",
  "models": [
    {
      "id": "openai/gpt-5.6-sol",
      "revision": 2,
      "provider_id": "openai",
      "model_id": "gpt-5.6-sol",
      "label": "GPT-5.6 Sol",
      "connection": {
        "default_base_url": "https://api.openai.com/v1",
        "allow_base_url_override": true,
        "auth_handler": "bearer_api_key"
      },
      "dimensions": [
        {
          "id": "api.protocol",
          "label": "API 协议",
          "type": "enum",
          "ordered": false,
          "allow_unset": false,
          "options": [
            {
              "id": "openai-responses",
              "label": "Responses"
            },
            {
              "id": "openai-compatible",
              "label": "Chat Completions"
            }
          ],
          "default_policy": {
            "type": "explicit",
            "value": "openai-responses",
            "source": "product"
          },
          "handler": "api_protocol",
          "ui": {
            "group": "connection",
            "order": 10
          },
          "source_refs": [
            "gpt-5.6-sol"
          ]
        },
        {
          "id": "reasoning.effort",
          "label": "推理强度",
          "type": "enum",
          "allow_unset": true,
          "options": [
            {
              "id": "none",
              "label": "none"
            },
            {
              "id": "low",
              "label": "low"
            },
            {
              "id": "medium",
              "label": "medium"
            },
            {
              "id": "high",
              "label": "high"
            },
            {
              "id": "xhigh",
              "label": "xhigh"
            },
            {
              "id": "max",
              "label": "max"
            }
          ],
          "source_refs": [
            "gpt-5.6-sol"
          ],
          "ordered": true,
          "handler": "reasoning_effort",
          "default_policy": {
            "official_value": "medium",
            "fallback": {
              "type": "middle_option",
              "candidates": [
                "low",
                "medium",
                "high",
                "xhigh",
                "max"
              ],
              "even_count": "lower"
            }
          },
          "ui": {
            "group": "reasoning",
            "order": 20
          }
        }
      ],
      "profiles": [
        {
          "protocol": "openai-responses",
          "route": "/responses",
          "dimension_ids": [
            "reasoning.effort"
          ],
          "function_calling": "supported",
          "source_refs": [
            "gpt-5.6-sol"
          ],
          "binding_status": "pending_api_reference_review",
          "bindings": [
            {
              "dimension": "reasoning.effort",
              "handler": "enum_body_field",
              "path": "/reasoning/effort"
            }
          ]
        },
        {
          "protocol": "openai-compatible",
          "route": "/chat/completions",
          "dimension_ids": [
            "reasoning.effort"
          ],
          "function_calling": "supported",
          "source_refs": [
            "gpt-5.6-sol"
          ],
          "binding_status": "pending_api_reference_review",
          "bindings": [
            {
              "dimension": "reasoning.effort",
              "handler": "enum_body_field",
              "path": "/reasoning_effort"
            }
          ]
        }
      ],
      "documented_facts": {
        "source_refs": [
          "gpt-5.6-sol"
        ],
        "input_modalities": [
          "text",
          "image"
        ],
        "output_modalities": [
          "text"
        ],
        "streaming": "supported",
        "default_snapshot": "gpt-5.6-sol"
      },
      "constraints": [],
      "limits": {
        "context_window_tokens": 1050000,
        "max_input_tokens": 922000,
        "max_output_tokens": 128000,
        "source_refs": [
          "gpt-5.6-sol"
        ]
      }
    },
    {
      "id": "openai/gpt-5.6-terra",
      "revision": 2,
      "provider_id": "openai",
      "model_id": "gpt-5.6-terra",
      "label": "GPT-5.6 Terra",
      "connection": {
        "default_base_url": "https://api.openai.com/v1",
        "allow_base_url_override": true,
        "auth_handler": "bearer_api_key"
      },
      "dimensions": [
        {
          "id": "api.protocol",
          "label": "API 协议",
          "type": "enum",
          "ordered": false,
          "allow_unset": false,
          "options": [
            {
              "id": "openai-responses",
              "label": "Responses"
            },
            {
              "id": "openai-compatible",
              "label": "Chat Completions"
            }
          ],
          "default_policy": {
            "type": "explicit",
            "value": "openai-responses",
            "source": "product"
          },
          "handler": "api_protocol",
          "ui": {
            "group": "connection",
            "order": 10
          },
          "source_refs": [
            "gpt-5.6-terra"
          ]
        },
        {
          "id": "reasoning.effort",
          "label": "推理强度",
          "type": "enum",
          "allow_unset": true,
          "options": [
            {
              "id": "none",
              "label": "none"
            },
            {
              "id": "low",
              "label": "low"
            },
            {
              "id": "medium",
              "label": "medium"
            },
            {
              "id": "high",
              "label": "high"
            },
            {
              "id": "xhigh",
              "label": "xhigh"
            },
            {
              "id": "max",
              "label": "max"
            }
          ],
          "source_refs": [
            "gpt-5.6-terra"
          ],
          "ordered": true,
          "handler": "reasoning_effort",
          "default_policy": {
            "official_value": "medium",
            "fallback": {
              "type": "middle_option",
              "candidates": [
                "low",
                "medium",
                "high",
                "xhigh",
                "max"
              ],
              "even_count": "lower"
            }
          },
          "ui": {
            "group": "reasoning",
            "order": 20
          }
        }
      ],
      "profiles": [
        {
          "protocol": "openai-responses",
          "route": "/responses",
          "dimension_ids": [
            "reasoning.effort"
          ],
          "function_calling": "supported",
          "source_refs": [
            "gpt-5.6-terra"
          ],
          "binding_status": "pending_api_reference_review",
          "bindings": [
            {
              "dimension": "reasoning.effort",
              "handler": "enum_body_field",
              "path": "/reasoning/effort"
            }
          ]
        },
        {
          "protocol": "openai-compatible",
          "route": "/chat/completions",
          "dimension_ids": [
            "reasoning.effort"
          ],
          "function_calling": "supported",
          "source_refs": [
            "gpt-5.6-terra"
          ],
          "binding_status": "pending_api_reference_review",
          "bindings": [
            {
              "dimension": "reasoning.effort",
              "handler": "enum_body_field",
              "path": "/reasoning_effort"
            }
          ]
        }
      ],
      "documented_facts": {
        "source_refs": [
          "gpt-5.6-terra"
        ],
        "input_modalities": [
          "text",
          "image"
        ],
        "output_modalities": [
          "text"
        ],
        "streaming": "supported",
        "default_snapshot": "gpt-5.6-terra"
      },
      "constraints": [],
      "limits": {
        "context_window_tokens": 1050000,
        "max_input_tokens": 922000,
        "max_output_tokens": 128000,
        "source_refs": [
          "gpt-5.6-terra"
        ]
      }
    },
    {
      "id": "openai/gpt-5.6-luna",
      "revision": 2,
      "provider_id": "openai",
      "model_id": "gpt-5.6-luna",
      "label": "GPT-5.6 Luna",
      "connection": {
        "default_base_url": "https://api.openai.com/v1",
        "allow_base_url_override": true,
        "auth_handler": "bearer_api_key"
      },
      "dimensions": [
        {
          "id": "api.protocol",
          "label": "API 协议",
          "type": "enum",
          "ordered": false,
          "allow_unset": false,
          "options": [
            {
              "id": "openai-responses",
              "label": "Responses"
            },
            {
              "id": "openai-compatible",
              "label": "Chat Completions"
            }
          ],
          "default_policy": {
            "type": "explicit",
            "value": "openai-responses",
            "source": "product"
          },
          "handler": "api_protocol",
          "ui": {
            "group": "connection",
            "order": 10
          },
          "source_refs": [
            "gpt-5.6-luna"
          ]
        },
        {
          "id": "reasoning.effort",
          "label": "推理强度",
          "type": "enum",
          "allow_unset": true,
          "options": [
            {
              "id": "none",
              "label": "none"
            },
            {
              "id": "low",
              "label": "low"
            },
            {
              "id": "medium",
              "label": "medium"
            },
            {
              "id": "high",
              "label": "high"
            },
            {
              "id": "xhigh",
              "label": "xhigh"
            },